{
  "input_record_count": 10,
  "selected_feature_count": 2,
  "sequence_count": 1,
  "feature_types": ["gene"],
  "window_size": 100,
  "step_size": 100,
  "bins": [
    {"seqid": "chr1", "start": 1, "end": 32, "feature_count": 2, "features_per_megabase": 62500.0}
  ],
  "warnings": ["sequence lengths were inferred from the maximum annotation end coordinate"]
}
